movie_title,Title_URL,image_url,movie_url,release_year,certificate,time,genre,stars,Score,description,director_url,director_name,cast_url1,cast1,cast_url2,cast2,cast_url3,cast3,cast_url4,cast4,votes
Shazam!,https://www.imdb.com/title/tt0448115/?ref_=kw_li_tt,"https://m.media-amazon.com/images/M/MV5BOWZhZjE4NGQtODg5Ni00MjQ1LWJmMzAtNzQ2N2M1NzYzMDJkXkEyXkFqcGdeQXVyMjMwNDgzNjc@._V1_UY209_CR0,0,140,209_AL_.jpg",https://www.imdb.com/title/tt0448115/?ref_=kw_li_i,(2019),PG-13,132 min,"Action, Adventure, Comedy",7.0,"71        
        Metascore",A newly fostered young boy in search of his mother instead finds unexpected super powers and soon gains a powerful enemy.,https://www.imdb.com/name/nm2497546/?ref_=kw_li_dr_0,David F. Sandberg,https://www.imdb.com/name/nm1157048/?ref_=kw_li_st_0,Zachary Levi,https://www.imdb.com/name/nm0835016/?ref_=kw_li_st_1,Mark Strong,https://www.imdb.com/name/nm4755508/?ref_=kw_li_st_2,Asher Angel,https://www.imdb.com/name/nm6244013/?ref_=kw_li_st_3,Jack Dylan Grazer,"335,718"
Little Women,https://www.imdb.com/title/tt3281548/?ref_=kw_li_tt,https://m.media-amazon.com/images/S/sash/4FyxwxECzL-U1J8.png,https://www.imdb.com/title/tt3281548/?ref_=kw_li_i,(2019),PG,135 min,"Drama, Romance",7.8,"91        
        Metascore","Jo March reflects back and forth on her life, telling the beloved story of the March sisters - four young women, each determined to live life on her own terms.",https://www.imdb.com/name/nm1950086/?ref_=kw_li_dr_0,Greta Gerwig,https://www.imdb.com/name/nm1519680/?ref_=kw_li_st_0,Saoirse Ronan,https://www.imdb.com/name/nm0914612/?ref_=kw_li_st_1,Emma Watson,https://www.imdb.com/name/nm6073955/?ref_=kw_li_st_2,Florence Pugh,https://www.imdb.com/name/nm7340546/?ref_=kw_li_st_3,Eliza Scanlen,"203,580"
A Bad Moms Christmas,https://www.imdb.com/title/tt6359956/?ref_=kw_li_tt,https://m.media-amazon.com/images/S/sash/4FyxwxECzL-U1J8.png,https://www.imdb.com/title/tt6359956/?ref_=kw_li_i,(2017),R,104 min,Comedy,5.6,"42        
        Metascore","As their own mothers drop in unexpectedly, our three under-appreciated and over-burdened moms rebel against the challenges and expectations of the Super Bowl for mothers: Christmas.",https://www.imdb.com/name/nm0524190/?ref_=kw_li_dr_0,Jon Lucas,https://www.imdb.com/name/nm0601859/?ref_=kw_li_dr_1,Scott Moore,https://www.imdb.com/name/nm0005109/?ref_=kw_li_st_0,Mila Kunis,https://www.imdb.com/name/nm0068338/?ref_=kw_li_st_1,Kristen Bell,https://www.imdb.com/name/nm1063517/?ref_=kw_li_st_2,Kathryn Hahn,"51,131"
The Grinch,https://www.imdb.com/title/tt2709692/?ref_=kw_li_tt,https://m.media-amazon.com/images/S/sash/4FyxwxECzL-U1J8.png,https://www.imdb.com/title/tt2709692/?ref_=kw_li_i,(2018),PG,85 min,"Animation, Comedy, Family",6.3,"51        
        Metascore",A grumpy Grinch plots to ruin Christmas for the village of Whoville.,https://www.imdb.com/name/nm0155528/?ref_=kw_li_dr_0,Yarrow Cheney,https://www.imdb.com/name/nm0608714/?ref_=kw_li_dr_1,Scott Mosier,https://www.imdb.com/name/nm1212722/?ref_=kw_li_st_0,Benedict Cumberbatch,https://www.imdb.com/name/nm7372981/?ref_=kw_li_st_1,Cameron Seely,https://www.imdb.com/name/nm0429069/?ref_=kw_li_st_2,Rashida Jones,"70,679"
Last Christmas,https://www.imdb.com/title/tt8623904/?ref_=kw_li_tt,https://m.media-amazon.com/images/S/sash/4FyxwxECzL-U1J8.png,https://www.imdb.com/title/tt8623904/?ref_=kw_li_i,(2019),PG-13,103 min,"Comedy, Drama, Fantasy",6.5,"50        
        Metascore","Kate is a young woman subscribed to bad decisions. Working as an elf in a year round Christmas store is not good for the wannabe singer. However, she meets Tom there. Her life takes a new turn. For Kate, it seems too good to be true.",https://www.imdb.com/name/nm0082450/?ref_=kw_li_dr_0,Paul Feig,https://www.imdb.com/name/nm10916154/?ref_=kw_li_st_0,Madison Ingoldsby,https://www.imdb.com/name/nm0000668/?ref_=kw_li_st_1,Emma Thompson,https://www.imdb.com/name/nm0410667/?ref_=kw_li_st_2,Boris Isakovic,https://www.imdb.com/name/nm8838405/?ref_=kw_li_st_3,Lucy Miller,"78,112"
Happiest Season,https://www.imdb.com/title/tt8522006/?ref_=kw_li_tt,https://m.media-amazon.com/images/S/sash/4FyxwxECzL-U1J8.png,https://www.imdb.com/title/tt8522006/?ref_=kw_li_i,(2020),PG-13,102 min,"Comedy, Drama, Romance",6.6,"69        
        Metascore","A holiday romantic comedy that captures the range of emotions tied to wanting your family's acceptance, being true to yourself, and trying not to ruin Christmas by revealing a nasty secret.",https://www.imdb.com/name/nm0245112/?ref_=kw_li_dr_0,Clea DuVall,https://www.imdb.com/name/nm0829576/?ref_=kw_li_st_0,Kristen Stewart,https://www.imdb.com/name/nm4496875/?ref_=kw_li_st_1,Mackenzie Davis,https://www.imdb.com/name/nm0005460/?ref_=kw_li_st_2,Mary Steenburgen,https://www.imdb.com/name/nm0001255/?ref_=kw_li_st_3,Victor Garber,"39,569"
Holidate,https://www.imdb.com/title/tt9866072/?ref_=kw_li_tt,https://m.media-amazon.com/images/S/sash/4FyxwxECzL-U1J8.png,https://www.imdb.com/title/tt9866072/?ref_=kw_li_i,(2020),TV-MA,104 min,"Comedy, Romance",6.1,"44        
        Metascore","Fed up with being single on holidays, two strangers agree to be each other's platonic plus-ones all year long, only to catch real feelings along the way.",https://www.imdb.com/name/nm0925870/?ref_=kw_li_dr_0,John Whitesell,https://www.imdb.com/name/nm0731075/?ref_=kw_li_st_0,Emma Roberts,https://www.imdb.com/name/nm3478396/?ref_=kw_li_st_1,Luke Bracey,https://www.imdb.com/name/nm0155693/?ref_=kw_li_st_2,Kristin Chenoweth,https://www.imdb.com/name/nm0004920/?ref_=kw_li_st_3,Frances Fisher,"65,781"
Klaus,https://www.imdb.com/title/tt4729430/?ref_=kw_li_tt,https://m.media-amazon.com/images/S/sash/4FyxwxECzL-U1J8.png,https://www.imdb.com/title/tt4729430/?ref_=kw_li_i,(2019),PG,96 min,"Animation, Adventure, Comedy",8.1,"65        
        Metascore","A simple act of kindness always sparks another, even in a frozen, faraway place. When Smeerensburg's new postman, Jesper, befriends toymaker Klaus, their gifts melt an age-old feud and deliver a sleigh full of holiday traditions.",https://www.imdb.com/name/nm0655053/?ref_=kw_li_dr_0,Sergio Pablos,https://www.imdb.com/name/nm3582089/?ref_=kw_li_dr_1,Carlos Martínez López,https://www.imdb.com/name/nm0005403/?ref_=kw_li_st_0,Jason Schwartzman,https://www.imdb.com/name/nm0799777/?ref_=kw_li_st_1,J.K. Simmons,https://www.imdb.com/name/nm0429069/?ref_=kw_li_st_2,Rashida Jones,"148,613"
Christmas at Castle Hart,https://www.imdb.com/title/tt15943556/?ref_=kw_li_tt,https://m.media-amazon.com/images/S/sash/4FyxwxECzL-U1J8.png,https://www.imdb.com/title/tt15943556/?ref_=kw_li_i,(2021 TV Movie),TV-G,84 min,Romance,6.3,,"Brooke Bennett goes to Ireland for Christmas to search for her Irish roots. While there, she meets Aiden Hart. Mistaken for an elite event planner, she's hired to host his castle's epic Christmas party.",https://www.imdb.com/name/nm0768737/?ref_=kw_li_dr_0,Stefan Scaini,https://www.imdb.com/name/nm0000327/?ref_=kw_li_st_0,Lacey Chabert,https://www.imdb.com/name/nm0870204/?ref_=kw_li_st_1,Stuart Townsend,https://www.imdb.com/name/nm9097615/?ref_=kw_li_st_2,Ali Hardiman,https://www.imdb.com/name/nm0002347/?ref_=kw_li_st_3,Kate O'Toole,"1,328"
The Christmas Train,https://www.imdb.com/title/tt7370936/?ref_=kw_li_tt,https://m.media-amazon.com/images/S/sash/4FyxwxECzL-U1J8.png,https://www.imdb.com/title/tt7370936/?ref_=kw_li_i,(2017 TV Movie),TV-G,99 min,"Drama, Romance",6.4,,"A cynical journalist decides to take a train from Washington, D.C. to Los Angeles for Christmas to get inspiration for a story in honor of his late father. He gets to know the other passengers and runs into an old flame while aboard.",https://www.imdb.com/name/nm0646987/?ref_=kw_li_dr_0,Ron Oliver,https://www.imdb.com/name/nm0000551/?ref_=kw_li_st_0,Dermot Mulroney,https://www.imdb.com/name/nm0931090/?ref_=kw_li_st_1,Kimberly Williams-Paisley,https://www.imdb.com/name/nm0000418/?ref_=kw_li_st_2,Danny Glover,https://www.imdb.com/name/nm0000349/?ref_=kw_li_st_3,Joan Cusack,"2,682"
Instant Family,https://www.imdb.com/title/tt7401588/?ref_=kw_li_tt,https://m.media-amazon.com/images/S/sash/4FyxwxECzL-U1J8.png,https://www.imdb.com/title/tt7401588/?ref_=kw_li_i,(2018),PG-13,118 min,"Comedy, Drama",7.3,"57        
        Metascore",A couple find themselves in over their heads when they foster three children.,https://www.imdb.com/name/nm1890845/?ref_=kw_li_dr_0,Sean Anders,https://www.imdb.com/name/nm0000242/?ref_=kw_li_st_0,Mark Wahlberg,https://www.imdb.com/name/nm0126284/?ref_=kw_li_st_1,Rose Byrne,https://www.imdb.com/name/nm5097044/?ref_=kw_li_st_2,Isabela Merced,https://www.imdb.com/name/nm4851894/?ref_=kw_li_st_3,Gustavo Escobar,"107,576"
The Christmas Chronicles,https://www.imdb.com/title/tt2990140/?ref_=kw_li_tt,https://m.media-amazon.com/images/S/sash/4FyxwxECzL-U1J8.png,https://www.imdb.com/title/tt2990140/?ref_=kw_li_i,(2018),PG,104 min,"Adventure, Comedy, Family",7.0,"52        
        Metascore","The story of sister and brother, Kate and Teddy Pierce, whose Christmas Eve plan to catch Santa Claus on camera turns into an unexpected journey that most kids could only dream about.",https://www.imdb.com/name/nm0443505/?ref_=kw_li_dr_0,Clay Kaytis,https://www.imdb.com/name/nm0000621/?ref_=kw_li_st_0,Kurt Russell,https://www.imdb.com/name/nm6081322/?ref_=kw_li_st_1,Darby Camp,https://www.imdb.com/name/nm6237346/?ref_=kw_li_st_2,Judah Lewis,https://www.imdb.com/name/nm0005029/?ref_=kw_li_st_3,Oliver Hudson,"72,575"
A Christmas Wish,https://www.imdb.com/title/tt10482348/?ref_=kw_li_tt,https://m.media-amazon.com/images/S/sash/4FyxwxECzL-U1J8.png,https://www.imdb.com/title/tt10482348/?ref_=kw_li_i,(2019 TV Movie),TV-PG,90 min,"Comedy, Drama, Family",6.3,,"Maddie slips in a wish that her sister Faith will experience true love for the first time. The next day, Faith meets seemingly-perfect Andrew, but is he really the one for her?",https://www.imdb.com/name/nm2672860/?ref_=kw_li_dr_0,Emily Moss Wilson,https://www.imdb.com/name/nm1122026/?ref_=kw_li_st_0,Hilarie Burton,https://www.imdb.com/name/nm1675091/?ref_=kw_li_st_1,Tyler Hilton,https://www.imdb.com/name/nm1177914/?ref_=kw_li_st_2,Megan Park,https://www.imdb.com/name/nm0635851/?ref_=kw_li_st_3,Lee Norris,882
Fatman,https://www.imdb.com/title/tt10310140/?ref_=kw_li_tt,https://m.media-amazon.com/images/S/sash/4FyxwxECzL-U1J8.png,https://www.imdb.com/title/tt10310140/?ref_=kw_li_i,(2020),R,100 min,"Action, Adventure, Comedy",5.9,"40        
        Metascore","A rowdy, unorthodox Santa Claus is fighting to save his declining business. Meanwhile, Billy, a neglected and precocious 12 year old, hires a hit man to kill Santa after receiving a lump of coal in his stocking.",https://www.imdb.com/name/nm1532523/?ref_=kw_li_dr_0,Eshom Nelms,https://www.imdb.com/name/nm1534497/?ref_=kw_li_dr_1,Ian Nelms,https://www.imdb.com/name/nm0000154/?ref_=kw_li_st_0,Mel Gibson,https://www.imdb.com/name/nm0324658/?ref_=kw_li_st_1,Walton Goggins,https://www.imdb.com/name/nm0001399/?ref_=kw_li_st_2,Marianne Jean-Baptiste,"25,257"
"Next Stop, Christmas",https://www.imdb.com/title/tt15412176/?ref_=kw_li_tt,https://m.media-amazon.com/images/S/sash/4FyxwxECzL-U1J8.png,https://www.imdb.com/title/tt15412176/?ref_=kw_li_i,(2021 TV Movie),TV-G,84 min,"Comedy, Drama, Fantasy",7.1,,Angie is determined to spend Christmas alone but her usual commuter ride turns into a Christmas train that drops her off in her home town in 2011.,https://www.imdb.com/name/nm1046566/?ref_=kw_li_dr_0,Dustin Rikert,https://www.imdb.com/name/nm0960912/?ref_=kw_li_st_0,Lyndsy Fonseca,https://www.imdb.com/name/nm3285029/?ref_=kw_li_st_1,Chandler Massey,https://www.imdb.com/name/nm0805785/?ref_=kw_li_st_2,Erika Slezak,https://www.imdb.com/name/nm6616977/?ref_=kw_li_st_3,Eric Freeman,"1,872"
Christmas on My Mind,https://www.imdb.com/title/tt11100776/?ref_=kw_li_tt,https://m.media-amazon.com/images/S/sash/4FyxwxECzL-U1J8.png,https://www.imdb.com/title/tt11100776/?ref_=kw_li_i,(2019 TV Movie),,84 min,"Comedy, Drama, Romance",6.5,,"When Lucy wakes up with a wedding dress in hand, she believes that she is late to her wedding with her ex-boyfriend Zach. However, she has no recollection of the past 2 years, including the fact that she is engaged to another man.",https://www.imdb.com/name/nm1656974/?ref_=kw_li_dr_0,Maclain Nelson,https://www.imdb.com/name/nm2230865/?ref_=kw_li_st_0,Ashley Greene,https://www.imdb.com/name/nm1027286/?ref_=kw_li_st_1,Andrew W. Walker,https://www.imdb.com/name/nm0364068/?ref_=kw_li_st_2,Jackée Harry,https://www.imdb.com/name/nm6297445/?ref_=kw_li_st_3,Donna Benedicto,"1,328"
One Royal Holiday,https://www.imdb.com/title/tt12773628/?ref_=kw_li_tt,https://m.media-amazon.com/images/S/sash/4FyxwxECzL-U1J8.png,https://www.imdb.com/title/tt12773628/?ref_=kw_li_i,(2020 TV Movie),TV-G,85 min,"Comedy, Drama, Family",7.0,,"When Anna offers a stranded mother and son shelter in a blizzard, she learns that they are the Royal Family of Galwick. Anna shows the Prince how they do Christmas in her hometown, encouraging him to open his heart and be true to himself.",https://www.imdb.com/name/nm1046566/?ref_=kw_li_dr_0,Dustin Rikert,https://www.imdb.com/name/nm2549143/?ref_=kw_li_st_0,Laura Osnes,https://www.imdb.com/name/nm4424397/?ref_=kw_li_st_1,Krystal Joy Brown,https://www.imdb.com/name/nm0569711/?ref_=kw_li_st_2,Tom McGowan,https://www.imdb.com/name/nm4741637/?ref_=kw_li_st_3,Bradley Rose,"1,940"
The Nine Kittens of Christmas,https://www.imdb.com/title/tt15226096/?ref_=kw_li_tt,https://m.media-amazon.com/images/S/sash/4FyxwxECzL-U1J8.png,https://www.imdb.com/title/tt15226096/?ref_=kw_li_i,(2021 TV Movie),TV-G,84 min,"Comedy, Drama, Family",6.7,,Zachary and Marilee are thrown back together at Christmas when they're tasked with finding homes for a litter of adorable kittens.,https://www.imdb.com/name/nm0003941/?ref_=kw_li_dr_0,David Winning,https://www.imdb.com/name/nm0746125/?ref_=kw_li_st_0,Brandon Routh,https://www.imdb.com/name/nm3666289/?ref_=kw_li_st_1,Kimberley Sustad,https://www.imdb.com/name/nm0002129/?ref_=kw_li_st_2,Gregory Harrison,https://www.imdb.com/name/nm3957563/?ref_=kw_li_st_3,Stephanie Bennett,"1,313"
A Timeless Christmas,https://www.imdb.com/title/tt13341414/?ref_=kw_li_tt,https://m.media-amazon.com/images/S/sash/4FyxwxECzL-U1J8.png,https://www.imdb.com/title/tt13341414/?ref_=kw_li_i,(2020 TV Movie),TV-G,84 min,"Comedy, Fantasy, Romance",7.1,,Charles Whitley travels from 1903 to 2020 where he meets Megan Turner and experiences a 21st Century Christmas.,https://www.imdb.com/name/nm0646987/?ref_=kw_li_dr_0,Ron Oliver,https://www.imdb.com/name/nm0128657/?ref_=kw_li_st_0,Erin Cahill,https://www.imdb.com/name/nm4518460/?ref_=kw_li_st_1,Ryan Paevey,https://www.imdb.com/name/nm1417897/?ref_=kw_li_st_2,Brandi Alexander,https://www.imdb.com/name/nm0354427/?ref_=kw_li_st_3,Zahf Paroo,"2,427"
My Christmas Family Tree,https://www.imdb.com/title/tt15508150/?ref_=kw_li_tt,https://m.media-amazon.com/images/S/sash/4FyxwxECzL-U1J8.png,https://www.imdb.com/title/tt15508150/?ref_=kw_li_i,(2021 TV Movie),TV-G,84 min,"Drama, Romance",7.7,,"When Vanessa receives the results from her Family Tree DNA test, she discovers a family she didn't know existed and travels to their home for Christmas.",https://www.imdb.com/name/nm1028302/?ref_=kw_li_dr_0,Jason Bourque,https://www.imdb.com/name/nm1631435/?ref_=kw_li_st_0,Aimee Teegarden,https://www.imdb.com/name/nm1027286/?ref_=kw_li_st_1,Andrew W. Walker,https://www.imdb.com/name/nm0876805/?ref_=kw_li_st_2,James Tupper,https://www.imdb.com/name/nm0189202/?ref_=kw_li_st_3,Kendall Cross,"1,734"
The Christmas Ring,https://www.imdb.com/title/tt13267034/?ref_=kw_li_tt,https://m.media-amazon.com/images/S/sash/4FyxwxECzL-U1J8.png,https://www.imdb.com/title/tt13267034/?ref_=kw_li_i,(2020 TV Movie),TV-G,84 min,"Drama, Romance",6.5,,A website writer tries to locate the owner of an antique engagement ring for her latest human interest story.,https://www.imdb.com/name/nm1758196/?ref_=kw_li_dr_0,Troy Scott,https://www.imdb.com/name/nm1345890/?ref_=kw_li_st_0,Nazneen Contractor,https://www.imdb.com/name/nm0022351/?ref_=kw_li_st_1,David Alpay,https://www.imdb.com/name/nm2831024/?ref_=kw_li_st_2,Kazumi Evans,https://www.imdb.com/name/nm3650800/?ref_=kw_li_st_3,Chelsey Reist,953
Office Christmas Party,https://www.imdb.com/title/tt1711525/?ref_=kw_li_tt,https://m.media-amazon.com/images/S/sash/4FyxwxECzL-U1J8.png,https://www.imdb.com/title/tt1711525/?ref_=kw_li_i,(2016),R,105 min,Comedy,5.8,"42        
        Metascore","When his uptight CEO sister threatens to shut down his branch, the branch manager throws an epic Christmas party in order to land a big client and save the day, but the party gets way out of hand...",https://www.imdb.com/name/nm0330347/?ref_=kw_li_dr_0,Josh Gordon,https://www.imdb.com/name/nm0817447/?ref_=kw_li_dr_1,Will Speck,https://www.imdb.com/name/nm0000867/?ref_=kw_li_st_0,Jason Bateman,https://www.imdb.com/name/nm1601397/?ref_=kw_li_st_1,Olivia Munn,https://www.imdb.com/name/nm2554352/?ref_=kw_li_st_2,T.J. Miller,"80,405"
The Christmas Chronicles: Part Two,https://www.imdb.com/title/tt11057644/?ref_=kw_li_tt,https://m.media-amazon.com/images/S/sash/4FyxwxECzL-U1J8.png,https://www.imdb.com/title/tt11057644/?ref_=kw_li_i,(2020),PG,112 min,"Adventure, Comedy, Family",6.0,"51        
        Metascore","Kate Pierce, now a cynical teen, is unexpectedly reunited with Santa Claus when a mysterious troublemaker threatens to cancel Christmas - forever.",https://www.imdb.com/name/nm0001060/?ref_=kw_li_dr_0,Chris Columbus,https://www.imdb.com/name/nm0000621/?ref_=kw_li_st_0,Kurt Russell,https://www.imdb.com/name/nm0000443/?ref_=kw_li_st_1,Goldie Hawn,https://www.imdb.com/name/nm6081322/?ref_=kw_li_st_2,Darby Camp,https://www.imdb.com/name/nm5421877/?ref_=kw_li_st_3,Julian Dennison,"30,027"
Time for Me to Come Home for Christmas,https://www.imdb.com/title/tt9093130/?ref_=kw_li_tt,https://m.media-amazon.com/images/S/sash/4FyxwxECzL-U1J8.png,https://www.imdb.com/title/tt9093130/?ref_=kw_li_i,(2018 TV Movie),TV-G,84 min,"Comedy, Drama, Music",6.6,,"When strangers Cara and Heath are stranded before Christmas, they embark on an unexpected journey that may give them the miracles they've been hoping for.",https://www.imdb.com/name/nm0003941/?ref_=kw_li_dr_0,David Winning,https://www.imdb.com/name/nm1259068/?ref_=kw_li_st_0,Josh Henderson,https://www.imdb.com/name/nm1177914/?ref_=kw_li_st_1,Megan Park,https://www.imdb.com/name/nm1535265/?ref_=kw_li_st_2,Lindsay Maxwell,https://www.imdb.com/name/nm0569295/?ref_=kw_li_st_3,Paul McGillion,"1,448"
8-Bit Christmas,https://www.imdb.com/title/tt11540284/?ref_=kw_li_tt,https://m.media-amazon.com/images/S/sash/4FyxwxECzL-U1J8.png,https://www.imdb.com/title/tt11540284/?ref_=kw_li_i,(2021),PG,97 min,"Comedy, Family",6.7,"66        
        Metascore","In 1980s Chicago, a 10-year-old sets out on a quest to get the Christmas gift of his generation: the latest and greatest video-game system.",https://www.imdb.com/name/nm0236226/?ref_=kw_li_dr_0,Michael Dowse,https://www.imdb.com/name/nm9121761/?ref_=kw_li_st_0,Winslow Fegley,https://www.imdb.com/name/nm0000439/?ref_=kw_li_st_1,Neil Patrick Harris,https://www.imdb.com/name/nm0001872/?ref_=kw_li_st_2,Steve Zahn,https://www.imdb.com/name/nm2053085/?ref_=kw_li_st_3,June Diane Raphael,"16,235"
The Nutcracker and the Four Realms,https://www.imdb.com/title/tt5523010/?ref_=kw_li_tt,https://m.media-amazon.com/images/S/sash/4FyxwxECzL-U1J8.png,https://www.imdb.com/title/tt5523010/?ref_=kw_li_i,(2018),PG,99 min,"Adventure, Family, Fantasy",5.5,"39        
        Metascore",A young girl is transported into a magical world of gingerbread soldiers and an army of mice.,https://www.imdb.com/name/nm0002120/?ref_=kw_li_dr_0,Lasse Hallström,https://www.imdb.com/name/nm0002653/?ref_=kw_li_dr_1,Joe Johnston,https://www.imdb.com/name/nm3237775/?ref_=kw_li_st_0,Mackenzie Foy,https://www.imdb.com/name/nm0461136/?ref_=kw_li_st_1,Keira Knightley,https://www.imdb.com/name/nm0000151/?ref_=kw_li_st_2,Morgan Freeman,"33,727"
Noelle,https://www.imdb.com/title/tt5097410/?ref_=kw_li_tt,https://m.media-amazon.com/images/S/sash/4FyxwxECzL-U1J8.png,https://www.imdb.com/title/tt5097410/?ref_=kw_li_i,(2019),G,100 min,"Adventure, Comedy, Family",6.3,"48        
        Metascore","Santa's daughter must take over the family business when her father retires and her brother, who is supposed to inherit the Santa role, gets cold feet.",https://www.imdb.com/name/nm0492909/?ref_=kw_li_dr_0,Marc Lawrence,https://www.imdb.com/name/nm0447695/?ref_=kw_li_st_0,Anna Kendrick,https://www.imdb.com/name/nm0000511/?ref_=kw_li_st_1,Shirley MacLaine,https://www.imdb.com/name/nm0352778/?ref_=kw_li_st_2,Bill Hader,https://www.imdb.com/name/nm4667984/?ref_=kw_li_st_3,Kingsley Ben-Adir,"21,640"
Switched for Christmas,https://www.imdb.com/title/tt7038606/?ref_=kw_li_tt,https://m.media-amazon.com/images/S/sash/4FyxwxECzL-U1J8.png,https://www.imdb.com/title/tt7038606/?ref_=kw_li_i,(2017 TV Movie),TV-G,90 min,"Comedy, Drama, Family",6.6,,"When identical twin sisters are stuck planning their respective Christmas parties, they're convinced the grass is greener on the other side and decide to swap lives for the holidays.",https://www.imdb.com/name/nm0295105/?ref_=kw_li_dr_0,Lee Friedlander,https://www.imdb.com/name/nm0121026/?ref_=kw_li_st_0,Candace Cameron Bure,https://www.imdb.com/name/nm0047248/?ref_=kw_li_st_1,Eion Bailey,https://www.imdb.com/name/nm0215293/?ref_=kw_li_st_2,Mark Deklin,https://www.imdb.com/name/nm4475298/?ref_=kw_li_st_3,Natasha Bure,"2,963"
Christmas by Starlight,https://www.imdb.com/title/tt13206476/?ref_=kw_li_tt,https://m.media-amazon.com/images/S/sash/4FyxwxECzL-U1J8.png,https://www.imdb.com/title/tt13206476/?ref_=kw_li_i,(2020 TV Movie),TV-G,84 min,"Comedy, Drama, Romance",7.2,,"When her family's beloved café is slated for demolition, Annie vows to put a stop to it before Christmas.",https://www.imdb.com/name/nm0946750/?ref_=kw_li_dr_0,Gary Yates,https://www.imdb.com/name/nm3666289/?ref_=kw_li_st_0,Kimberley Sustad,https://www.imdb.com/name/nm1353748/?ref_=kw_li_st_1,Paul Campbell,https://www.imdb.com/name/nm8674941/?ref_=kw_li_st_2,Darren Martens,https://www.imdb.com/name/nm0206079/?ref_=kw_li_st_3,Bruce Dawson,"1,716"
Chateau Christmas,https://www.imdb.com/title/tt13350688/?ref_=kw_li_tt,https://m.media-amazon.com/images/S/sash/4FyxwxECzL-U1J8.png,https://www.imdb.com/title/tt13350688/?ref_=kw_li_i,(2020 TV Movie),TV-G,84 min,"Comedy, Drama, Music",6.4,,"World-famous pianist Margot returns to Chateau Neuhaus for Christmas. While there she reunites with her ex-boyfriend Jackson, who convinces her to headline their annual Christmas Concert.",https://www.imdb.com/name/nm0733227/?ref_=kw_li_dr_0,Michael Robison,https://www.imdb.com/name/nm2278896/?ref_=kw_li_st_0,Merritt Patterson,https://www.imdb.com/name/nm1682832/?ref_=kw_li_st_1,Luke Macfarlane,https://www.imdb.com/name/nm1237948/?ref_=kw_li_st_2,Jesse Hutch,https://www.imdb.com/name/nm1365460/?ref_=kw_li_st_3,Julia Benson,"1,479"
The Perfect Christmas Present,https://www.imdb.com/title/tt6398464/?ref_=kw_li_tt,https://m.media-amazon.com/images/S/sash/4FyxwxECzL-U1J8.png,https://www.imdb.com/title/tt6398464/?ref_=kw_li_i,(2017 TV Movie),TV-G,82 min,"Drama, Romance",6.3,,"Tom is called Mr. Christmas due to his ability to determine the perfect Christmas gift for someone, befitting their personality.",https://www.imdb.com/name/nm0370912/?ref_=kw_li_dr_0,Blair Hayes,https://www.imdb.com/name/nm0656335/?ref_=kw_li_st_0,Sam Page,https://www.imdb.com/name/nm2849965/?ref_=kw_li_st_1,Tara Holt,https://www.imdb.com/name/nm8313477/?ref_=kw_li_st_2,Sam Guinan-Nyhart,https://www.imdb.com/name/nm3938797/?ref_=kw_li_st_3,Emily Peterson,"1,581"
Home Sweet Home Alone,https://www.imdb.com/title/tt11012066/?ref_=kw_li_tt,https://m.media-amazon.com/images/S/sash/4FyxwxECzL-U1J8.png,https://www.imdb.com/title/tt11012066/?ref_=kw_li_i,(2021),PG,93 min,"Comedy, Crime, Family",3.6,"35        
        Metascore",A married couple tries to steal back a valuable heirloom from a troublesome kid.,https://www.imdb.com/name/nm0563243/?ref_=kw_li_dr_0,Dan Mazer,https://www.imdb.com/name/nm2608689/?ref_=kw_li_st_0,Ellie Kemper,https://www.imdb.com/name/nm3008739/?ref_=kw_li_st_1,Rob Delaney,https://www.imdb.com/name/nm9987228/?ref_=kw_li_st_2,Archie Yates,https://www.imdb.com/name/nm3201406/?ref_=kw_li_st_3,Aisling Bea,"16,924"
Home for Christmas,https://www.imdb.com/title/tt10069398/?ref_=kw_li_tt,https://m.media-amazon.com/images/S/sash/4FyxwxECzL-U1J8.png,https://www.imdb.com/title/tt10069398/?ref_=kw_li_i,(2019–2020),TV-MA,29 min,"Comedy, Drama, Romance",7.7,,"When the constant comments on her single status and society's expectations of the perfect family Christmas finally get to 30-year-old Johanne, she starts a 24-day hunt for a partner to bring home for Christmas.",https://www.imdb.com/name/nm0832509/?ref_=kw_li_st_0,Dennis Storhøi,https://www.imdb.com/name/nm2639419/?ref_=kw_li_st_1,Ida Elise Broch,https://www.imdb.com/name/nm3433423/?ref_=kw_li_st_2,Oddgeir Thune,https://www.imdb.com/name/nm0778278/?ref_=kw_li_st_3,Hege Schøyen,,,"14,096"
Christmas with the Darlings,https://www.imdb.com/title/tt13381368/?ref_=kw_li_tt,https://m.media-amazon.com/images/S/sash/4FyxwxECzL-U1J8.png,https://www.imdb.com/title/tt13381368/?ref_=kw_li_i,(2020 TV Movie),TV-G,84 min,"Comedy, Family, Romance",7.1,,A woman helps a charming man look after his orphaned nieces and nephew during the holidays.,https://www.imdb.com/name/nm0194274/?ref_=kw_li_dr_0,Catherine Cyran,https://www.imdb.com/name/nm0492345/?ref_=kw_li_st_0,Katrina Law,https://www.imdb.com/name/nm2473790/?ref_=kw_li_st_1,Carlo Marks,https://www.imdb.com/name/nm0045584/?ref_=kw_li_st_2,Steve Bacic,https://www.imdb.com/name/nm6752526/?ref_=kw_li_st_3,Islie Hirvonen,"1,390"
