movie_title,Title_URL,image_url,movie_url,release_year,certificate,time,genre,stars,Score,description,director_url,director_name,cast_url1,cast1,cast_url2,cast2,cast_url3,cast3,cast_url4,cast4,votes
The Sweetest Christmas,https://www.imdb.com/title/tt7030432/?ref_=kw_li_tt,https://m.media-amazon.com/images/S/sash/4FyxwxECzL-U1J8.png,"https://www.imdb.com/search/keyword/?keywords=christmas-movie&mode=detail&page=3&release_date=2016%2C2022&ref_=kw_nxt&sort=moviemeter,asc#",(2017 TV Movie),TV-G,90 min,"Comedy, Drama, Romance",6.3,,"Kylie is expecting a proposal from her boyfriend/boss at a restaurant and gets a promotion instead. The restaurant owner is her old high school boyfriend, she hasn't seen in years. They help each other out. Love in the air?",https://www.imdb.com/name/nm0409036/?ref_=kw_li_dr_0,Terry Ingram,https://www.imdb.com/name/nm0000327/?ref_=kw_li_st_0,Lacey Chabert,https://www.imdb.com/name/nm0168398/?ref_=kw_li_st_1,Lea Coco,https://www.imdb.com/name/nm0011095/?ref_=kw_li_st_2,Jonathan Adams,https://www.imdb.com/name/nm8612288/?ref_=kw_li_st_3,Brenden Sunderland,"2,360"
Christmas in Tune,https://www.imdb.com/title/tt15254212/?ref_=kw_li_tt,https://m.media-amazon.com/images/S/sash/4FyxwxECzL-U1J8.png,"https://www.imdb.com/search/keyword/?keywords=christmas-movie&mode=detail&page=3&release_date=2016%2C2022&ref_=kw_nxt&sort=moviemeter,asc#",(2021 TV Movie),TV-PG,87 min,"Drama, Romance",7.0,,"The story of Belle, a marketing executive who is worried that she might lose her job.",https://www.imdb.com/name/nm2672860/?ref_=kw_li_dr_0,Emily Moss Wilson,https://www.imdb.com/name/nm0005207/?ref_=kw_li_st_0,Reba McEntire,https://www.imdb.com/name/nm0773884/?ref_=kw_li_st_1,John Schneider,https://www.imdb.com/name/nm2127038/?ref_=kw_li_st_2,Candice King,https://www.imdb.com/name/nm8303358/?ref_=kw_li_st_3,Justin David,535
A Christmas Arrangement,https://www.imdb.com/title/tt8672786/?ref_=kw_li_tt,https://m.media-amazon.com/images/S/sash/4FyxwxECzL-U1J8.png,"https://www.imdb.com/search/keyword/?keywords=christmas-movie&mode=detail&page=3&release_date=2016%2C2022&ref_=kw_nxt&sort=moviemeter,asc#",(2018 TV Movie),TV-14,90 min,"Comedy, Romance",5.4,,"A flower shop owner enters the local Holiday Floral Show in an effort to win a cash prize to help keep her struggling business afloat, but she starts to fall for one of her direct competitors.",https://www.imdb.com/name/nm3401440/?ref_=kw_li_dr_0,Jake Helgren,https://www.imdb.com/name/nm1764351/?ref_=kw_li_st_0,Nicky Whelan,https://www.imdb.com/name/nm0279702/?ref_=kw_li_st_1,Miles Fisher,https://www.imdb.com/name/nm0001879/?ref_=kw_li_st_2,Daphne Zuniga,https://www.imdb.com/name/nm1617837/?ref_=kw_li_st_3,Julie McNiven,541
Blending Christmas,https://www.imdb.com/title/tt14444182/?ref_=kw_li_tt,https://m.media-amazon.com/images/S/sash/4FyxwxECzL-U1J8.png,"https://www.imdb.com/search/keyword/?keywords=christmas-movie&mode=detail&page=3&release_date=2016%2C2022&ref_=kw_nxt&sort=moviemeter,asc#",(2021 TV Movie),TV-PG,85 min,"Comedy, Drama, Family",5.5,,The holiday season is in full swing when Emma learns that the resort where she used to spend Christmases with her family is being redeveloped.,https://www.imdb.com/name/nm0005448/?ref_=kw_li_dr_0,Marla Sokoloff,https://www.imdb.com/name/nm0240380/?ref_=kw_li_st_0,Haylie Duff,https://www.imdb.com/name/nm3093351/?ref_=kw_li_st_1,Aaron O'Connell,https://www.imdb.com/name/nm0460843/?ref_=kw_li_st_2,Christopher Knight,https://www.imdb.com/name/nm0519654/?ref_=kw_li_st_3,Mike Lookinland,354
A Puppy for Christmas,https://www.imdb.com/title/tt6275674/?ref_=kw_li_tt,https://m.media-amazon.com/images/S/sash/4FyxwxECzL-U1J8.png,"https://www.imdb.com/search/keyword/?keywords=christmas-movie&mode=detail&page=3&release_date=2016%2C2022&ref_=kw_nxt&sort=moviemeter,asc#",(2016 TV Movie),TV-PG,85 min,"Comedy, Drama, Romance",5.9,,"After adopting a cute puppy, Noelle's world is turned upside down when her boyfriend breaks up with her. After accepting an invitation to spend the holidays with a co-worker, she is ...                See full summary »",https://www.imdb.com/name/nm3452373/?ref_=kw_li_dr_0,Justin G. Dyck,https://www.imdb.com/name/nm1223545/?ref_=kw_li_st_0,Cindy Busby,https://www.imdb.com/name/nm1625795/?ref_=kw_li_st_1,Greyston Holt,https://www.imdb.com/name/nm0751076/?ref_=kw_li_st_2,Christopher Russell,https://www.imdb.com/name/nm5148120/?ref_=kw_li_st_3,Allison Price,"1,017"
Christmas Scavenger Hunt,https://www.imdb.com/title/tt10768278/?ref_=kw_li_tt,https://m.media-amazon.com/images/S/sash/4FyxwxECzL-U1J8.png,"https://www.imdb.com/search/keyword/?keywords=christmas-movie&mode=detail&page=3&release_date=2016%2C2022&ref_=kw_nxt&sort=moviemeter,asc#",(2019 TV Movie),TV-G,82 min,"Comedy, Drama, Romance",6.0,,"When Belinda heads back to her hometown for the holidays, things get complicated when she teams-up with her ex-boyfriend for the annual Christmas scavenger hunt.",https://www.imdb.com/name/nm0333239/?ref_=kw_li_dr_0,Marita Grabiak,https://www.imdb.com/name/nm2137418/?ref_=kw_li_st_0,Kim Shaw,https://www.imdb.com/name/nm3972260/?ref_=kw_li_st_1,Kevin McGarry,https://www.imdb.com/name/nm0000792/?ref_=kw_li_st_2,Tom Arnold,https://www.imdb.com/name/nm7950030/?ref_=kw_li_st_3,Kathryn Kohut,"1,189"
Christmas Encore,https://www.imdb.com/title/tt7714138/?ref_=kw_li_tt,https://m.media-amazon.com/images/S/sash/4FyxwxECzL-U1J8.png,"https://www.imdb.com/search/keyword/?keywords=christmas-movie&mode=detail&page=3&release_date=2016%2C2022&ref_=kw_nxt&sort=moviemeter,asc#",(2017 TV Movie),TV-G,83 min,"Drama, Romance",5.8,,A struggling actress auditions for the lead role in a theater production of 'A Christmas Carol'.,https://www.imdb.com/name/nm0909568/?ref_=kw_li_dr_0,Bradley Walsh,https://www.imdb.com/name/nm0493279/?ref_=kw_li_st_0,Maggie Lawson,https://www.imdb.com/name/nm0254392/?ref_=kw_li_st_1,Brennan Elliott,https://www.imdb.com/name/nm0385543/?ref_=kw_li_st_2,Art Hindle,https://www.imdb.com/name/nm0398485/?ref_=kw_li_st_3,Tracey Hoyt,"1,150"
Feast of the Seven Fishes,https://www.imdb.com/title/tt7846056/?ref_=kw_li_tt,https://m.media-amazon.com/images/S/sash/4FyxwxECzL-U1J8.png,"https://www.imdb.com/search/keyword/?keywords=christmas-movie&mode=detail&page=3&release_date=2016%2C2022&ref_=kw_nxt&sort=moviemeter,asc#",(2019),,99 min,Comedy,6.7,"68        
        Metascore","A slice of life story that follows a large Italian family on Christmas Eve as they prepare for the traditional Feast of the Seven Fishes, reminisce about the past, and seek love in the future.",https://www.imdb.com/name/nm0864016/?ref_=kw_li_dr_0,Robert Tinnell,https://www.imdb.com/name/nm2733631/?ref_=kw_li_st_0,Tony Bingham,https://www.imdb.com/name/nm1711114/?ref_=kw_li_st_1,Skyler Gisondo,https://www.imdb.com/name/nm0070115/?ref_=kw_li_st_2,Paul Ben-Victor,https://www.imdb.com/name/nm0953631/?ref_=kw_li_st_3,Jean Zarzour,"1,283"
Christmas Connection,https://www.imdb.com/title/tt7630836/?ref_=kw_li_tt,https://m.media-amazon.com/images/S/sash/4FyxwxECzL-U1J8.png,"https://www.imdb.com/search/keyword/?keywords=christmas-movie&mode=detail&page=3&release_date=2016%2C2022&ref_=kw_nxt&sort=moviemeter,asc#",(2017 TV Movie),TV-G,83 min,"Comedy, Drama, Family",6.4,,A flight attendant teams up with a newspaper columnist to investigate how her late-parents first met.,https://www.imdb.com/name/nm0003458/?ref_=kw_li_dr_0,Steven R. Monroe,https://www.imdb.com/name/nm0004786/?ref_=kw_li_st_0,Brooke Burns,https://www.imdb.com/name/nm0779866/?ref_=kw_li_st_1,Tom Everett Scott,https://www.imdb.com/name/nm9476787/?ref_=kw_li_st_2,Sophie Neudorf,https://www.imdb.com/name/nm0545629/?ref_=kw_li_st_3,Micheline Marchildon,"1,823"
Christmas List,https://www.imdb.com/title/tt5902138/?ref_=kw_li_tt,https://m.media-amazon.com/images/S/sash/4FyxwxECzL-U1J8.png,"https://www.imdb.com/search/keyword/?keywords=christmas-movie&mode=detail&page=3&release_date=2016%2C2022&ref_=kw_nxt&sort=moviemeter,asc#",(2016 TV Movie),TV-G,84 min,"Comedy, Drama, Romance",6.1,,"Isobel plans a storybook Christmas with her boyfriend, including a cottage in the Northwest and a bucket list of holiday traditions. But when he goes AWOL, the list proves challenging and a tempting new romance turns her life upside down.",https://www.imdb.com/name/nm0442237/?ref_=kw_li_dr_0,Paul A. Kaufman,https://www.imdb.com/name/nm0001860/?ref_=kw_li_st_0,Alicia Witt,https://www.imdb.com/name/nm0389527/?ref_=kw_li_st_1,Gabriel Hogan,https://www.imdb.com/name/nm1193045/?ref_=kw_li_st_2,Peter Benson,https://www.imdb.com/name/nm0134281/?ref_=kw_li_st_3,Wanda Cannon,"2,009"
Welcome to Christmas,https://www.imdb.com/title/tt9033308/?ref_=kw_li_tt,https://m.media-amazon.com/images/S/sash/4FyxwxECzL-U1J8.png,"https://www.imdb.com/search/keyword/?keywords=christmas-movie&mode=detail&page=3&release_date=2016%2C2022&ref_=kw_nxt&sort=moviemeter,asc#",(2018 TV Movie),TV-G,90 min,"Comedy, Drama, Romance",6.3,,"A resort developer tasked with finding a location for a new ski resort is assigned to visit the small town of Christmas, Colorado.",https://www.imdb.com/name/nm0367524/?ref_=kw_li_dr_0,Gary Harvey,https://www.imdb.com/name/nm0531095/?ref_=kw_li_st_0,Eric Mabius,https://www.imdb.com/name/nm0278304/?ref_=kw_li_st_1,Jennifer Finnigan,https://www.imdb.com/name/nm0389623/?ref_=kw_li_st_2,Susan Hogan,https://www.imdb.com/name/nm5879099/?ref_=kw_li_st_3,Lauren McNamara,"1,299"
"It's Christmas, Eve",https://www.imdb.com/title/tt8300786/?ref_=kw_li_tt,https://m.media-amazon.com/images/S/sash/4FyxwxECzL-U1J8.png,"https://www.imdb.com/search/keyword/?keywords=christmas-movie&mode=detail&page=3&release_date=2016%2C2022&ref_=kw_nxt&sort=moviemeter,asc#",(2018 TV Movie),TV-G,84 min,"Drama, Music, Romance",6.5,,"An interim school superintendent finds herself in a tough spot when she is assigned to shut down a school's failing music program, and must come to terms with her musical past.",https://www.imdb.com/name/nm0847749/?ref_=kw_li_dr_0,Tibor Takács,https://www.imdb.com/name/nm0005361/?ref_=kw_li_st_0,LeAnn Rimes,https://www.imdb.com/name/nm0405281/?ref_=kw_li_st_1,Tyler Hynes,https://www.imdb.com/name/nm0909657/?ref_=kw_li_st_2,Gwynyth Walsh,https://www.imdb.com/name/nm0002799/?ref_=kw_li_st_3,Laurie Murdoch,"1,237"
Boyfriends of Christmas Past,https://www.imdb.com/title/tt15706104/?ref_=kw_li_tt,https://m.media-amazon.com/images/S/sash/4FyxwxECzL-U1J8.png,"https://www.imdb.com/search/keyword/?keywords=christmas-movie&mode=detail&page=3&release_date=2016%2C2022&ref_=kw_nxt&sort=moviemeter,asc#",(2021 TV Movie),TV-G,84 min,"Comedy, Fantasy, Romance",6.0,,"Leading up to Christmas, Lauren is visited by the ghosts of three ex-boyfriends. She must learn to open her heart or risk losing her best friend, Nate.",https://www.imdb.com/name/nm0564260/?ref_=kw_li_dr_0,Don McBrearty,https://www.imdb.com/name/nm2637109/?ref_=kw_li_st_0,Catherine Haena Kim,https://www.imdb.com/name/nm2917725/?ref_=kw_li_st_1,Raymond Ablack,https://www.imdb.com/name/nm8190800/?ref_=kw_li_st_2,Jenna Katz,https://www.imdb.com/name/nm0498004/?ref_=kw_li_st_3,Paul Sun-Hyung Lee,"1,049"
Hometown Holiday,https://www.imdb.com/title/tt8659750/?ref_=kw_li_tt,https://m.media-amazon.com/images/S/sash/4FyxwxECzL-U1J8.png,"https://www.imdb.com/search/keyword/?keywords=christmas-movie&mode=detail&page=3&release_date=2016%2C2022&ref_=kw_nxt&sort=moviemeter,asc#",(2018 TV Movie),TV-PG,84 min,"Comedy, Drama, Romance",5.1,,"Krista is starting this New Year with a new business and a resolution to be more selective with who she dates. When Krista meets Ryan Rourke, an entertainment lawyer from LA, the two really...                See full summary »",https://www.imdb.com/name/nm3452373/?ref_=kw_li_dr_0,Justin G. Dyck,https://www.imdb.com/name/nm6245524/?ref_=kw_li_st_0,Sarah Troyer,https://www.imdb.com/name/nm8145723/?ref_=kw_li_st_1,Bradley Hamilton,https://www.imdb.com/name/nm3972260/?ref_=kw_li_st_2,Kevin McGarry,https://www.imdb.com/name/nm5462803/?ref_=kw_li_st_3,Samantha Gracie,"1,044"
"Love Always, Santa",https://www.imdb.com/title/tt6085974/?ref_=kw_li_tt,https://m.media-amazon.com/images/S/sash/4FyxwxECzL-U1J8.png,"https://www.imdb.com/search/keyword/?keywords=christmas-movie&mode=detail&page=3&release_date=2016%2C2022&ref_=kw_nxt&sort=moviemeter,asc#",(2016 TV Movie),TV-G,84 min,"Drama, Romance",6.6,,"A widow's daughter writes to Santa Claus, asking for her mother to find love again. When a struggling writer receives the letter, he finds new inspiration and the beginnings of a romance.",https://www.imdb.com/name/nm1435762/?ref_=kw_li_dr_0,Brian Herzlinger,https://www.imdb.com/name/nm0603413/?ref_=kw_li_st_0,Marguerite Moreau,https://www.imdb.com/name/nm1395512/?ref_=kw_li_st_1,Mike Faiola,https://www.imdb.com/name/nm0807501/?ref_=kw_li_st_2,Brady Smith,https://www.imdb.com/name/nm8558285/?ref_=kw_li_st_3,Isadora Swann,"1,620"
A Very Merry Toy Store,https://www.imdb.com/title/tt7069196/?ref_=kw_li_tt,https://m.media-amazon.com/images/S/sash/4FyxwxECzL-U1J8.png,"https://www.imdb.com/search/keyword/?keywords=christmas-movie&mode=detail&page=3&release_date=2016%2C2022&ref_=kw_nxt&sort=moviemeter,asc#",(2017 TV Movie),TV-PG,90 min,"Comedy, Drama, Family",5.5,,Two rival toy shop owners reluctantly join forces when an unscrupulous toy magnate opens a box store in their town.,https://www.imdb.com/name/nm0366472/?ref_=kw_li_dr_0,Paula Hart,https://www.imdb.com/name/nm0004997/?ref_=kw_li_st_0,Melissa Joan Hart,https://www.imdb.com/name/nm0530249/?ref_=kw_li_st_1,Mario Lopez,https://www.imdb.com/name/nm2544577/?ref_=kw_li_st_2,Dan Amboyer,https://www.imdb.com/name/nm3137184/?ref_=kw_li_st_3,Kurt Cole,"1,002"
Road to Christmas,https://www.imdb.com/title/tt8732914/?ref_=kw_li_tt,https://m.media-amazon.com/images/S/sash/4FyxwxECzL-U1J8.png,"https://www.imdb.com/search/keyword/?keywords=christmas-movie&mode=detail&page=3&release_date=2016%2C2022&ref_=kw_nxt&sort=moviemeter,asc#",(2018 TV Movie),TV-G,84 min,"Comedy, Drama, Romance",6.7,,"A TV producer is producing a Christmas Special for the 5th year but she is then told to co-produce it with the host's son. Initially, she's not too happy about it but - Christmas brings friends and families together.",https://www.imdb.com/name/nm0363473/?ref_=kw_li_dr_0,Allan Harmon,https://www.imdb.com/name/nm1789336/?ref_=kw_li_st_0,Jessy Schram,https://www.imdb.com/name/nm0745186/?ref_=kw_li_st_1,Teryl Rothery,https://www.imdb.com/name/nm5006748/?ref_=kw_li_st_2,Matreya Scarrwener,https://www.imdb.com/name/nm0614877/?ref_=kw_li_st_3,Chad Michael Murray,"1,921"
My Christmas Love,https://www.imdb.com/title/tt6104760/?ref_=kw_li_tt,https://m.media-amazon.com/images/S/sash/4FyxwxECzL-U1J8.png,"https://www.imdb.com/search/keyword/?keywords=christmas-movie&mode=detail&page=3&release_date=2016%2C2022&ref_=kw_nxt&sort=moviemeter,asc#",(2016 TV Movie),TV-G,85 min,"Comedy, Romance",6.2,,"A hopeless romantic who can't ever seem to give a guy a real chance begins receiving each of the ""12 Days of Christmas"" as gifts anonymously at her door and begins to believe that the mystery suitor may finally live up to her expectations.",https://www.imdb.com/name/nm0279567/?ref_=kw_li_dr_0,Jeff Fisher,https://www.imdb.com/name/nm2993517/?ref_=kw_li_st_0,Meredith Hagner,https://www.imdb.com/name/nm2092545/?ref_=kw_li_st_1,Bobby Campo,https://www.imdb.com/name/nm1177914/?ref_=kw_li_st_2,Megan Park,https://www.imdb.com/name/nm3093351/?ref_=kw_li_st_3,Aaron O'Connell,"2,662"
Santa's Boots,https://www.imdb.com/title/tt9028942/?ref_=kw_li_tt,https://m.media-amazon.com/images/S/sash/4FyxwxECzL-U1J8.png,"https://www.imdb.com/search/keyword/?keywords=christmas-movie&mode=detail&page=3&release_date=2016%2C2022&ref_=kw_nxt&sort=moviemeter,asc#",(2018 TV Movie),TV-PG,90 min,"Comedy, Drama, Romance",6.2,,"Forced to take a vacation from her job in Seattle, Holly returns to her hometown where she reluctantly agrees to become Santa's new elf at her dad's local department store.",https://www.imdb.com/name/nm0866122/?ref_=kw_li_dr_0,Shawn Tolleson,https://www.imdb.com/name/nm2047859/?ref_=kw_li_st_0,Megan Hilty,https://www.imdb.com/name/nm3718062/?ref_=kw_li_st_1,Noah Mills,https://www.imdb.com/name/nm0188220/?ref_=kw_li_st_2,Roark Critchlow,https://www.imdb.com/name/nm2111860/?ref_=kw_li_st_3,Patricia Isaac,611
The Christmas Setup,https://www.imdb.com/title/tt13147656/?ref_=kw_li_tt,https://m.media-amazon.com/images/S/sash/4FyxwxECzL-U1J8.png,"https://www.imdb.com/search/keyword/?keywords=christmas-movie&mode=detail&page=3&release_date=2016%2C2022&ref_=kw_nxt&sort=moviemeter,asc#",(2020 TV Movie),TV-PG,85 min,"Drama, Romance",6.8,,"As they enjoy the local holidays together, Hugo and Patrick's attraction to each other is undeniable but as Hugo receives word of a big promotion requiring a move to London, he must decide what is most important to him.",https://www.imdb.com/name/nm1319591/?ref_=kw_li_dr_0,Pat Mills,https://www.imdb.com/name/nm2313157/?ref_=kw_li_st_0,Ben Lewis,https://www.imdb.com/name/nm2114050/?ref_=kw_li_st_1,Blake Lee,https://www.imdb.com/name/nm0000376/?ref_=kw_li_st_2,Fran Drescher,https://www.imdb.com/name/nm2771798/?ref_=kw_li_st_3,Ellen Wong,"2,305"
Christmas Under the Stars,https://www.imdb.com/title/tt10922658/?ref_=kw_li_tt,https://m.media-amazon.com/images/S/sash/4FyxwxECzL-U1J8.png,"https://www.imdb.com/search/keyword/?keywords=christmas-movie&mode=detail&page=3&release_date=2016%2C2022&ref_=kw_nxt&sort=moviemeter,asc#",(2019 TV Movie),TV-G,82 min,"Drama, Romance",6.8,,A Christmas-tree lot helps two people rediscover their holiday spirit.,https://www.imdb.com/name/nm0363473/?ref_=kw_li_dr_0,Allan Harmon,https://www.imdb.com/name/nm0582462/?ref_=kw_li_st_0,Jesse Metcalfe,https://www.imdb.com/name/nm1032208/?ref_=kw_li_st_1,Autumn Reeser,https://www.imdb.com/name/nm0676370/?ref_=kw_li_st_2,Clarke Peters,https://www.imdb.com/name/nm6836099/?ref_=kw_li_st_3,Anthony Bolognese,"1,881"
Our Christmas Love Song,https://www.imdb.com/title/tt11171322/?ref_=kw_li_tt,https://m.media-amazon.com/images/S/sash/4FyxwxECzL-U1J8.png,"https://www.imdb.com/search/keyword/?keywords=christmas-movie&mode=detail&page=3&release_date=2016%2C2022&ref_=kw_nxt&sort=moviemeter,asc#",(2019 TV Movie),Not Rated,82 min,"Drama, Music, Romance",6.3,,"When a country music star is accused of plagiarizing her new Christmas song, she returns to her hometown for the holiday season to try and find proof of authorship.",https://www.imdb.com/name/nm0946750/?ref_=kw_li_dr_0,Gary Yates,https://www.imdb.com/name/nm0001860/?ref_=kw_li_st_0,Alicia Witt,https://www.imdb.com/name/nm0385639/?ref_=kw_li_st_1,Brendan Hines,https://www.imdb.com/name/nm3870572/?ref_=kw_li_st_2,Andrea del Campo,https://www.imdb.com/name/nm10406991/?ref_=kw_li_st_3,Anna Anderson-Epp,948
Christmas a la Mode,https://www.imdb.com/title/tt10210182/?ref_=kw_li_tt,https://m.media-amazon.com/images/S/sash/4FyxwxECzL-U1J8.png,"https://www.imdb.com/search/keyword/?keywords=christmas-movie&mode=detail&page=3&release_date=2016%2C2022&ref_=kw_nxt&sort=moviemeter,asc#",(2019 TV Movie),TV-PG,87 min,"Drama, Romance",6.4,,A woman needs a miracle in order to save her family's farm and her father's legacy in time for a happy Christmas.,https://www.imdb.com/name/nm0830387/?ref_=kw_li_dr_0,John Stimpson,https://www.imdb.com/name/nm1813088/?ref_=kw_li_st_0,Katie Leclerc,https://www.imdb.com/name/nm5536718/?ref_=kw_li_st_1,Ryan Cooper,https://www.imdb.com/name/nm10167633/?ref_=kw_li_st_2,Jennifer Ellis,https://www.imdb.com/name/nm3995229/?ref_=kw_li_st_3,Kathy Harum,961
Christmas in Evergreen: Letters to Santa,https://www.imdb.com/title/tt9033634/?ref_=kw_li_tt,https://m.media-amazon.com/images/S/sash/4FyxwxECzL-U1J8.png,"https://www.imdb.com/search/keyword/?keywords=christmas-movie&mode=detail&page=3&release_date=2016%2C2022&ref_=kw_nxt&sort=moviemeter,asc#",(2018 TV Movie),TV-G,84 min,"Drama, Fantasy, Romance",6.6,,Lisa Palmer's trip home to Evergreen for the holidays finds her fulfilling the wishes of a Christmas Past and finding a romance full of Christmas magic. Stars Jill Wagner and Mark Deklin.,https://www.imdb.com/name/nm0573732/?ref_=kw_li_dr_0,Sean McNamara,https://www.imdb.com/name/nm1489978/?ref_=kw_li_st_0,Jill Wagner,https://www.imdb.com/name/nm0215293/?ref_=kw_li_st_1,Mark Deklin,https://www.imdb.com/name/nm0005372/?ref_=kw_li_st_2,Holly Robinson Peete,https://www.imdb.com/name/nm0018271/?ref_=kw_li_st_3,Barbara Niven,"1,763"
The Christmas Listing,https://www.imdb.com/title/tt11753704/?ref_=kw_li_tt,https://m.media-amazon.com/images/S/sash/4FyxwxECzL-U1J8.png,"https://www.imdb.com/search/keyword/?keywords=christmas-movie&mode=detail&page=3&release_date=2016%2C2022&ref_=kw_nxt&sort=moviemeter,asc#",(2020),TV-PG,84 min,"Drama, Romance",5.1,,Two realtors compete for the same listing and have to spend time together at an Inn during Christmas.,https://www.imdb.com/name/nm3037403/?ref_=kw_li_dr_0,Elizabeth Snoderly,https://www.imdb.com/name/nm2524051/?ref_=kw_li_st_0,Lexi Giovagnoli,https://www.imdb.com/name/nm5966739/?ref_=kw_li_st_1,Travis Burns,https://www.imdb.com/name/nm0263760/?ref_=kw_li_st_2,Greg Evigan,https://www.imdb.com/name/nm9903089/?ref_=kw_li_st_3,Rachel O'Connell,526
A Very Charming Christmas Town,https://www.imdb.com/title/tt11929008/?ref_=kw_li_tt,https://m.media-amazon.com/images/S/sash/4FyxwxECzL-U1J8.png,"https://www.imdb.com/search/keyword/?keywords=christmas-movie&mode=detail&page=4&release_date=2016%2C2022&ref_=kw_nxt&sort=moviemeter,asc#",(2020 TV Movie),TV-PG,88 min,"Comedy, Drama, Romance",5.9,,A lifestyle blogger is assigned to write a news story on a small tourist town for the Christmas season.,https://www.imdb.com/name/nm3401440/?ref_=kw_li_dr_0,Jake Helgren,https://www.imdb.com/name/nm2834250/?ref_=kw_li_st_0,Natalie Hall,https://www.imdb.com/name/nm2062720/?ref_=kw_li_st_1,Jon Prescott,https://www.imdb.com/name/nm4275908/?ref_=kw_li_st_2,Kelley Jakle,https://www.imdb.com/name/nm0668534/?ref_=kw_li_st_3,Jo Marie Payton,798
Christmas in Homestead,https://www.imdb.com/title/tt6273004/?ref_=kw_li_tt,https://m.media-amazon.com/images/S/sash/4FyxwxECzL-U1J8.png,"https://www.imdb.com/search/keyword/?keywords=christmas-movie&mode=detail&page=4&release_date=2016%2C2022&ref_=kw_nxt&sort=moviemeter,asc#",(2016 TV Movie),TV-G,84 min,Romance,6.5,,Life is turned upside down for a small town mayor when a famous actress arrives to shoot her new Christmas movie.,https://www.imdb.com/name/nm0003458/?ref_=kw_li_dr_0,Steven R. Monroe,https://www.imdb.com/name/nm1543157/?ref_=kw_li_st_0,Taylor Cole,https://www.imdb.com/name/nm1640279/?ref_=kw_li_st_1,Michael Rady,https://www.imdb.com/name/nm4755952/?ref_=kw_li_st_2,Brooklyn Rae Silzer,https://www.imdb.com/name/nm0105226/?ref_=kw_li_st_3,Jeff Branson,"2,416"
Christmas Wonderland,https://www.imdb.com/title/tt9028856/?ref_=kw_li_tt,https://m.media-amazon.com/images/S/sash/4FyxwxECzL-U1J8.png,"https://www.imdb.com/search/keyword/?keywords=christmas-movie&mode=detail&page=4&release_date=2016%2C2022&ref_=kw_nxt&sort=moviemeter,asc#",(2018 TV Movie),TV-G,120 min,"Comedy, Drama, Romance",5.9,,"""Heidi (Osment), who initially left her small town of Pleasant Valley with the dream of one day becoming a successful painter, has put her own art on hold to excel as an art gallery curator...                See full summary »",https://www.imdb.com/name/nm1235963/?ref_=kw_li_dr_0,Sean Olson,https://www.imdb.com/name/nm0652089/?ref_=kw_li_st_0,Emily Osment,https://www.imdb.com/name/nm2970390/?ref_=kw_li_st_1,Ryan Rottman,https://www.imdb.com/name/nm0005026/?ref_=kw_li_st_2,Kelly Hu,https://www.imdb.com/name/nm5752521/?ref_=kw_li_st_3,Jacob Buster,"3,152"
Christmas Pen Pals,https://www.imdb.com/title/tt8942494/?ref_=kw_li_tt,https://m.media-amazon.com/images/S/sash/4FyxwxECzL-U1J8.png,"https://www.imdb.com/search/keyword/?keywords=christmas-movie&mode=detail&page=4&release_date=2016%2C2022&ref_=kw_nxt&sort=moviemeter,asc#",(2018 TV Movie),TV-PG,90 min,"Comedy, Drama, Romance",7.0,,"After being dumped by her boyfriend, a successful tech wiz dating-app creator returns to her hometown for the holiday season, and her dad gets her to sign up for the annual Christmas Cupid anonymous matchmaking event.",https://www.imdb.com/name/nm0222668/?ref_=kw_li_dr_0,Siobhan Devine,https://www.imdb.com/name/nm0237711/?ref_=kw_li_st_0,Sarah Drew,https://www.imdb.com/name/nm2473076/?ref_=kw_li_st_1,Niall Matter,https://www.imdb.com/name/nm0343447/?ref_=kw_li_st_2,Michael Gross,https://www.imdb.com/name/nm0953065/?ref_=kw_li_st_3,Chiara Zanni,"1,266"
Picture Perfect Royal Christmas,https://www.imdb.com/title/tt10154790/?ref_=kw_li_tt,https://m.media-amazon.com/images/S/sash/4FyxwxECzL-U1J8.png,"https://www.imdb.com/search/keyword/?keywords=christmas-movie&mode=detail&page=4&release_date=2016%2C2022&ref_=kw_nxt&sort=moviemeter,asc#",(2020 TV Movie),,90 min,"Family, Romance",5.5,,Amanda is the assistant to a famous photographer. Her boss receives an invitation to photograph the Christmas festivities in the kingdom of Pantrea and Amanda goes posing as her. She will ...                See full summary »,https://www.imdb.com/name/nm1359237/?ref_=kw_li_dr_0,Todor Chapkanov,https://www.imdb.com/name/nm1861467/?ref_=kw_li_st_0,Roxanne McKee,https://www.imdb.com/name/nm4268006/?ref_=kw_li_st_1,David Witts,https://www.imdb.com/name/nm0001830/?ref_=kw_li_st_2,Sophie Ward,https://www.imdb.com/name/nm1070538/?ref_=kw_li_st_3,Sophie Vavasseur,366
